{
  "conditions": [
    {
      "argv": [
        "diffeoforge",
        "modern-benchmark",
        "<verified-source-config>",
        "--subjects",
        "5",
        "--repeats",
        "5",
        "--warmups",
        "1",
        "--tile-autograd-strategy",
        "standard",
        "--output",
        "conditions/condition-001-subjects-00005-standard"
      ],
      "condition_id": "condition-001-subjects-00005-standard",
      "output_directory": "conditions/condition-001-subjects-00005-standard",
      "pair_id": "subjects-00005",
      "sequence": 1,
      "subject_count": 5,
      "tile_autograd_strategy": "standard"
    },
    {
      "argv": [
        "diffeoforge",
        "modern-benchmark",
        "<verified-source-config>",
        "--subjects",
        "5",
        "--repeats",
        "5",
        "--warmups",
        "1",
        "--tile-autograd-strategy",
        "recompute",
        "--output",
        "conditions/condition-002-subjects-00005-recompute"
      ],
      "condition_id": "condition-002-subjects-00005-recompute",
      "output_directory": "conditions/condition-002-subjects-00005-recompute",
      "pair_id": "subjects-00005",
      "sequence": 2,
      "subject_count": 5,
      "tile_autograd_strategy": "recompute"
    },
    {
      "argv": [
        "diffeoforge",
        "modern-benchmark",
        "<verified-source-config>",
        "--subjects",
        "3",
        "--repeats",
        "5",
        "--warmups",
        "1",
        "--tile-autograd-strategy",
        "standard",
        "--output",
        "conditions/condition-003-subjects-00003-standard"
      ],
      "condition_id": "condition-003-subjects-00003-standard",
      "output_directory": "conditions/condition-003-subjects-00003-standard",
      "pair_id": "subjects-00003",
      "sequence": 3,
      "subject_count": 3,
      "tile_autograd_strategy": "standard"
    },
    {
      "argv": [
        "diffeoforge",
        "modern-benchmark",
        "<verified-source-config>",
        "--subjects",
        "3",
        "--repeats",
        "5",
        "--warmups",
        "1",
        "--tile-autograd-strategy",
        "recompute",
        "--output",
        "conditions/condition-004-subjects-00003-recompute"
      ],
      "condition_id": "condition-004-subjects-00003-recompute",
      "output_directory": "conditions/condition-004-subjects-00003-recompute",
      "pair_id": "subjects-00003",
      "sequence": 4,
      "subject_count": 3,
      "tile_autograd_strategy": "recompute"
    },
    {
      "argv": [
        "diffeoforge",
        "modern-benchmark",
        "<verified-source-config>",
        "--subjects",
        "1",
        "--repeats",
        "5",
        "--warmups",
        "1",
        "--tile-autograd-strategy",
        "standard",
        "--output",
        "conditions/condition-005-subjects-00001-standard"
      ],
      "condition_id": "condition-005-subjects-00001-standard",
      "output_directory": "conditions/condition-005-subjects-00001-standard",
      "pair_id": "subjects-00001",
      "sequence": 5,
      "subject_count": 1,
      "tile_autograd_strategy": "standard"
    },
    {
      "argv": [
        "diffeoforge",
        "modern-benchmark",
        "<verified-source-config>",
        "--subjects",
        "1",
        "--repeats",
        "5",
        "--warmups",
        "1",
        "--tile-autograd-strategy",
        "recompute",
        "--output",
        "conditions/condition-006-subjects-00001-recompute"
      ],
      "condition_id": "condition-006-subjects-00001-recompute",
      "output_directory": "conditions/condition-006-subjects-00001-recompute",
      "pair_id": "subjects-00001",
      "sequence": 6,
      "subject_count": 1,
      "tile_autograd_strategy": "recompute"
    }
  ],
  "configuration": {
    "attachment_type": "current",
    "control_points": 9,
    "flow_integrator": "deformetrica_heun",
    "gradient_block": "momenta",
    "pairwise_evaluation": {
      "mode": "blockwise",
      "query_tile_size": 64,
      "source_tile_size": 64
    },
    "random_seed": 20260715,
    "shooting_integrator": "rk2",
    "threads": 1,
    "timepoints": 5
  },
  "created_at": "2026-07-22T16:45:02+00:00",
  "design_id": "paired_tile_autograd",
  "design_version": "0.1",
  "input": {
    "available_subject_count": 5,
    "selection": "first subjects in validated deterministic path order",
    "subjects": [
      {
        "bytes": 10026,
        "label": "subject-01.vtk",
        "points": 162,
        "role": "subject",
        "sha256": "25c07a447699028e63b535c00ca094803664fcda15595c1645d9cb3a5b73233b",
        "triangles": 320
      },
      {
        "bytes": 10024,
        "label": "subject-02.vtk",
        "points": 162,
        "role": "subject",
        "sha256": "932d282639be32a04f127f86ba67bb9b2d7559a849a0169f7e87e668dbec9cc2",
        "triangles": 320
      },
      {
        "bytes": 10038,
        "label": "subject-03.vtk",
        "points": 162,
        "role": "subject",
        "sha256": "87503b00d72e5700619a3c46a9dca185f42e5be8b362de7087b3d9b97a9a8486",
        "triangles": 320
      },
      {
        "bytes": 10026,
        "label": "subject-04.vtk",
        "points": 162,
        "role": "subject",
        "sha256": "b69329d0832bd5a0ec90827cd3d0f90dc6e8b30adb3239eb6b2131b09163e848",
        "triangles": 320
      },
      {
        "bytes": 10030,
        "label": "subject-05.vtk",
        "points": 162,
        "role": "subject",
        "sha256": "0703116ec14196cb1d2737ccbc1467a170404101ae6749e8a1867bf44030c325",
        "triangles": 320
      }
    ],
    "template": {
      "bytes": 10021,
      "label": "template.vtk",
      "points": 162,
      "role": "template",
      "sha256": "e3f5fa71028d419e28e07403af2eff932d6e950acce9a989e1f1a2cc441b8325",
      "triangles": 320
    }
  },
  "protocol": {
    "analysis_policy": "Preserve separate raw reports; do not automatically select a winner, calculate speedup or significance, choose a preset, or extrapolate to a full workflow or larger cohort.",
    "frozen_before_results": true,
    "order_algorithm": "sha256-ranked-pairs-and-within-pair-strategies-v0.1",
    "order_seed": 20260722,
    "pairing": "standard and recompute share each subject-prefix size",
    "repeats_per_condition": 5,
    "strategies": [
      "standard",
      "recompute"
    ],
    "subject_counts": [
      1,
      3,
      5
    ],
    "warmup_evaluations_per_repeat": 1
  },
  "scientific_boundary": "This artifact freezes a paired objective/gradient benchmark design before results exist. It performs no benchmark, statistical analysis, peak-memory measurement, full-workflow measurement, safe-preset selection, scaling inference, or 300-subject feasibility test.",
  "software": {
    "benchmark_version": "0.3",
    "diffeoforge": "0.0.0.dev0"
  },
  "source_config": {
    "filename": "minimal-modern-atlas-blockwise.yaml",
    "project": "synthetic-modern-atlas-blockwise",
    "sha256": "80484b95e4ed113752372df7e8597e9049c7e16133f3d8fd8b35ceb8e8b3472a"
  }
}
